{
  "$schema": "https://json-schema.org/draft/2020-12/schema",
  "type": "object",
  "additionalProperties": false,
  "required": ["schemaVersion", "id", "version", "choices"],
  "properties": {
    "schemaVersion": { "const": 1 },
    "id": { "type": "string", "minLength": 1, "maxLength": 128 },
    "version": { "type": "string", "minLength": 1, "maxLength": 128 },
    "choices": {
      "type": "array",
      "minItems": 1,
      "maxItems": 64,
      "items": { "type": "object" }
    }
  }
}
